전송시각,키워드,기사시각,제목,요약,링크
2026-07-03 15:12,김민석,2026-07-03 15:08,[포토]'대화하는 정청래-송영길-김민석',"정청래 전 더불어민주당 대표(왼쪽부터)와 송영길 전 대표, 김민석 전 총리가 3일 서울 용산구 서울드래곤시티에서 열린 22대 후반기 국회 대비 더불어민주당 국회의원 워크숍에서 대화하고 있다.",https://www.edaily.co.kr/news/newspath.asp?newsid=03942566645510912
2026-07-03 15:12,김민석,2026-07-03 15:08,[포토]'민주당 워크숍 참석한 정청래-송영길-김민석',"정청래 전 더불어민주당 대표(왼쪽부터)와 송영길 전 대표, 김민석 전 총리가 3일 서울 용산구 서울드래곤시티에서 열린 22대 후반기 국회 대비 더불어민주당 국회의원 워크숍에 참석해 있다.",https://www.edaily.co.kr/news/newspath.asp?newsid=03952406645510912
2026-07-03 15:12,김민석,2026-07-03 15:09,악수하는 더불어민주당 정청래-김민석 의원,"더불어민주당 정청래, 김민석 의원이 3일 오후 서울 용산구 서울드래곤시티호텔에서 열린 더불어민주당 제22대 후반기 국회 대비 국회의원 워크숍에서 악수를 하며 인사를 나누고 있다.",https://www.dailian.co.kr/news/view/1663191/?sc=Naver
2026-07-03 15:12,김민석,2026-07-03 15:09,"한병도 “李 정부 국정과제 입법, 연말까지 마무리할 것”","김민석 전 총리와 정청래 전 대표, 송영길 의원 등 차기 당권 주자들도 한자리에 모였다. 한 직무대행은 “후반기 국회는 쉼 없이 달리면서 일하는 만큼 성과를 만드는 국회가 될 것”이라며 “무엇보다 민주당은 이재명...",https://www.sedaily.com/article/20063536?ref=naver
2026-07-03 15:12,김민석,2026-07-03 15:11,인사 나누는 민주당 김민석-정청래 의원,"더불어민주당 정청래, 김민석 의원이 3일 오후 서울 용산구 서울드래곤시티호텔에서 열린 더불어민주당 제22대 후반기 국회 대비 국회의원 워크숍에서 악수를 하며 인사를 나누고 있다.",https://www.dailian.co.kr/news/view/1663192/?sc=Naver
